{
  "schema_version": "1.0.0",
  "render_id": "render_01HZX8H7J2V3M4N5P6Q7R8S9T0",
  "asset_id": "asset_01HZX8A7J2V3M4N5P6Q7R8S9T0",
  "version_id": "ver_01HZX8G7J2V3M4N5P6Q7R8S9T0",
  "kind": "preview",
  "created_at": "2026-04-14T20:20:20Z",
  "output": {
    "path": "renders/render_01HZX8H7J2V3M4N5P6Q7R8S9T0.mp3",
    "format": "mp3",
    "codec": "mp3",
    "sample_rate_hz": 44100,
    "channels": 2,
    "duration_seconds": 4.0,
    "file_size_bytes": 48211
  },
  "loudness_summary": {
    "integrated_lufs": -15.1,
    "true_peak_dbtp": -1.2
  },
  "warnings": []
}
